{"status":"completed","captured_at":"2026-09-04","pages_visited":[1,2,3,4,5,6,7,8,9,10,11,12,13],"results":[{"rank":1,"url":"https://www.fincaraiz.com.co/apartamento-en-arriendo-en-el-tuno-bogota/193937433","rent_cop":476893,"administration_cop":123107,"total_monthly_cop":600000,"bedrooms":2,"area_m2":48,"laundry_evidence":"zona de lavado"},{"rank":2,"url":"https://www.fincaraiz.com.co/apartamento-en-arriendo-en-el-tuno-bogota/194117864","rent_cop":527002,"administration_cop":122998,"total_monthly_cop":650000,"bedrooms":2,"area_m2":47,"laundry_evidence":"zona de lavado"},{"rank":3,"url":"https://www.fincaraiz.com.co/apartamento-en-arriendo-en-juan-rey-bogota/193429444","rent_cop":650000,"administration_cop":0,"total_monthly_cop":650000,"bedrooms":3,"area_m2":52,"laundry_evidence":"zona de lavado"},{"rank":4,"url":"https://www.fincaraiz.com.co/apartamento-en-arriendo-en-el-tuno-bogota/193912941","rent_cop":576893,"administration_cop":123107,"total_monthly_cop":700000,"bedrooms":3,"area_m2":48,"laundry_evidence":"zona de lavado"},{"rank":5,"url":"https://www.fincaraiz.com.co/apartamento-en-arriendo-en-santa-rita-sur-oriental-bogota/193814059","rent_cop":730000,"administration_cop":0,"total_monthly_cop":730000,"bedrooms":2,"area_m2":45,"laundry_evidence":"zona de lavanderia"},{"rank":6,"url":"https://www.fincaraiz.com.co/apartamento-en-arriendo-en-el-tuno-bogota/194110641","rent_cop":626893,"administration_cop":123107,"total_monthly_cop":750000,"bedrooms":2,"area_m2":47,"laundry_evidence":"zona de lavado"},{"rank":7,"url":"https://www.fincaraiz.com.co/apartamento-en-arriendo-en-usminia-bogota/193693623","rent_cop":626900,"administration_cop":123100,"total_monthly_cop":750000,"bedrooms":2,"area_m2":47,"laundry_evidence":"zona de lavado"},{"rank":8,"url":"https://www.fincaraiz.com.co/apartamento-en-arriendo-en-el-tuno-bogota/194038302","rent_cop":626978,"administration_cop":123022,"total_monthly_cop":750000,"bedrooms":3,"area_m2":47,"laundry_evidence":"zona de lavado"},{"rank":9,"url":"https://www.fincaraiz.com.co/apartamento-en-arriendo-en-usme-centro-bogota/193697033","rent_cop":660976,"administration_cop":89024,"total_monthly_cop":750000,"bedrooms":3,"area_m2":48,"laundry_evidence":"zona de lavanderia"},{"rank":10,"url":"https://www.fincaraiz.com.co/apartamento-en-arriendo-en-granada-sur-bogota/194066112","rent_cop":750000,"administration_cop":0,"total_monthly_cop":750000,"bedrooms":3,"area_m2":60,"laundry_evidence":"zona de lavanderia"},{"rank":11,"url":"https://www.fincaraiz.com.co/apartamento-en-arriendo-en-el-cortijo-bogota/194108340","rent_cop":800000,"administration_cop":0,"total_monthly_cop":800000,"bedrooms":2,"area_m2":45,"laundry_evidence":"zona de lavado"},{"rank":12,"url":"https://www.fincaraiz.com.co/apartamento-en-arriendo-en-el-tuno-bogota/194075937","rent_cop":800000,"administration_cop":0,"total_monthly_cop":800000,"bedrooms":3,"area_m2":57,"laundry_evidence":"zona de lavado"},{"rank":13,"url":"https://www.fincaraiz.com.co/apartamento-en-arriendo-en-el-uval-rural-bogota/194092005","rent_cop":800000,"administration_cop":0,"total_monthly_cop":800000,"bedrooms":3,"area_m2":56,"laundry_evidence":"zona de ropas"},{"rank":14,"url":"https://www.fincaraiz.com.co/apartamento-en-arriendo-en-olarte-bogota/193729380","rent_cop":800000,"administration_cop":0,"total_monthly_cop":800000,"bedrooms":2,"area_m2":48,"laundry_evidence":"zona de lavado"},{"rank":15,"url":"https://www.fincaraiz.com.co/apartamento-en-arriendo-en-villa-israel-bogota/194135338","rent_cop":800000,"administration_cop":0,"total_monthly_cop":800000,"bedrooms":2,"area_m2":45,"laundry_evidence":"zona de lavanderia"},{"rank":16,"url":"https://www.fincaraiz.com.co/apartamento-en-arriendo-en-el-tuno-bogota/194047116","rent_cop":720167,"administration_cop":129833,"total_monthly_cop":850000,"bedrooms":3,"area_m2":57,"laundry_evidence":"zona de lavado"},{"rank":17,"url":"https://www.fincaraiz.com.co/apartamento-en-arriendo-en-bosa-bogota/194181981","rent_cop":770500,"administration_cop":79500,"total_monthly_cop":850000,"bedrooms":3,"area_m2":48,"laundry_evidence":"zona de ropas"},{"rank":18,"url":"https://www.fincaraiz.com.co/apartamento-en-arriendo-en-el-tuno-bogota/193754866","rent_cop":850000,"administration_cop":0,"total_monthly_cop":850000,"bedrooms":3,"area_m2":50,"laundry_evidence":"zona de lavanderia"},{"rank":19,"url":"https://www.fincaraiz.com.co/apartamento-en-arriendo-en-san-carlos-bogota/193363667","rent_cop":850000,"administration_cop":0,"total_monthly_cop":850000,"bedrooms":2,"area_m2":48,"laundry_evidence":"zona de lavanderia"},{"rank":20,"url":"https://www.fincaraiz.com.co/apartamento-en-arriendo-en-villa-gladys-bogota/194187239","rent_cop":850000,"administration_cop":0,"total_monthly_cop":850000,"bedrooms":2,"area_m2":45,"laundry_evidence":"zona de lavanderia"},{"rank":21,"url":"https://www.fincaraiz.com.co/apartamento-en-arriendo-en-santa-rita-sur-oriental-bogota/193814184","rent_cop":880000,"administration_cop":0,"total_monthly_cop":880000,"bedrooms":2,"area_m2":52,"laundry_evidence":"zona de lavanderia"},{"rank":22,"url":"https://www.fincaraiz.com.co/apartamento-en-arriendo-en-el-tuno-bogota/193775700","rent_cop":772854,"administration_cop":127146,"total_monthly_cop":900000,"bedrooms":2,"area_m2":50,"laundry_evidence":"zona de lavado"},{"rank":23,"url":"https://www.fincaraiz.com.co/apartamento-en-arriendo-en-bosa-bogota/194042193","rent_cop":818600,"administration_cop":81400,"total_monthly_cop":900000,"bedrooms":3,"area_m2":47,"laundry_evidence":"zona de lavado"},{"rank":24,"url":"https://www.fincaraiz.com.co/apartamento-en-arriendo-en-bosa-bogota/193317551","rent_cop":900000,"administration_cop":0,"total_monthly_cop":900000,"bedrooms":2,"area_m2":84,"laundry_evidence":"zona de lavado"},{"rank":25,"url":"https://www.fincaraiz.com.co/apartamento-en-arriendo-en-bosa-bogota/193759108","rent_cop":900000,"administration_cop":0,"total_monthly_cop":900000,"bedrooms":3,"area_m2":48,"laundry_evidence":"zona de lavanderia"},{"rank":26,"url":"https://www.fincaraiz.com.co/apartamento-en-arriendo-en-el-cortijo-bogota/194192032","rent_cop":900000,"administration_cop":0,"total_monthly_cop":900000,"bedrooms":2,"area_m2":45,"laundry_evidence":"zona de lavado"},{"rank":27,"url":"https://www.fincaraiz.com.co/apartamento-en-arriendo-en-el-tuno-bogota/194102408","rent_cop":900000,"administration_cop":0,"total_monthly_cop":900000,"bedrooms":3,"area_m2":54,"laundry_evidence":"zona de lavanderia"},{"rank":28,"url":"https://www.fincaraiz.com.co/apartamento-en-arriendo-en-el-tuno-bogota/194174055","rent_cop":900000,"administration_cop":0,"total_monthly_cop":900000,"bedrooms":3,"area_m2":57,"laundry_evidence":"zona de lavanderia"},{"rank":29,"url":"https://www.fincaraiz.com.co/apartamento-en-arriendo-en-el-tuno-bogota/194190386","rent_cop":900000,"administration_cop":0,"total_monthly_cop":900000,"bedrooms":3,"area_m2":45,"laundry_evidence":"zona de lavado"},{"rank":30,"url":"https://www.fincaraiz.com.co/apartamento-en-arriendo-en-el-uval-bogota/194128632","rent_cop":900000,"administration_cop":0,"total_monthly_cop":900000,"bedrooms":3,"area_m2":47,"laundry_evidence":"zona de ropas"},{"rank":31,"url":"https://www.fincaraiz.com.co/apartamento-en-arriendo-en-el-virrey-bogota/194054830","rent_cop":900000,"administration_cop":0,"total_monthly_cop":900000,"bedrooms":2,"area_m2":72,"laundry_evidence":"zona de lavado"},{"rank":32,"url":"https://www.fincaraiz.com.co/apartamento-en-arriendo-en-patio-bonito-et-iii-bogota/194163874","rent_cop":900000,"administration_cop":0,"total_monthly_cop":900000,"bedrooms":2,"area_m2":55,"laundry_evidence":"zona de lavanderia"},{"rank":33,"url":"https://www.fincaraiz.com.co/apartamento-en-arriendo-en-zona-sur-bogota/194167930","rent_cop":900000,"administration_cop":0,"total_monthly_cop":900000,"bedrooms":2,"area_m2":60,"laundry_evidence":"zona de ropas"},{"rank":34,"url":"https://www.fincaraiz.com.co/apartamento-en-arriendo-en-bogota/194191621","rent_cop":950000,"administration_cop":0,"total_monthly_cop":950000,"bedrooms":3,"area_m2":75,"laundry_evidence":"zona de lavanderia"},{"rank":35,"url":"https://www.fincaraiz.com.co/apartamento-en-arriendo-en-el-tuno-bogota/194079676","rent_cop":950000,"administration_cop":0,"total_monthly_cop":950000,"bedrooms":3,"area_m2":47,"laundry_evidence":"zona de ropas"},{"rank":36,"url":"https://www.fincaraiz.com.co/apartamento-en-arriendo-en-la-aurora-bogota/194103946","rent_cop":950000,"administration_cop":0,"total_monthly_cop":950000,"bedrooms":3,"area_m2":50,"laundry_evidence":"zona de lavanderia"},{"rank":37,"url":"https://www.fincaraiz.com.co/apartamento-en-arriendo-en-bogota/193956886","rent_cop":850000,"administration_cop":150000,"total_monthly_cop":1000000,"bedrooms":2,"area_m2":45,"laundry_evidence":"zona de lavanderia"},{"rank":38,"url":"https://www.fincaraiz.com.co/apartamento-en-arriendo-en-alameda-bogota/194080085","rent_cop":1000000,"administration_cop":0,"total_monthly_cop":1000000,"bedrooms":3,"area_m2":52,"laundry_evidence":"zona de lavanderia"},{"rank":39,"url":"https://www.fincaraiz.com.co/apartamento-en-arriendo-en-bosa-chicala-bogota/194133423","rent_cop":1000000,"administration_cop":0,"total_monthly_cop":1000000,"bedrooms":3,"area_m2":47,"laundry_evidence":"zona de lavanderia"},{"rank":40,"url":"https://www.fincaraiz.com.co/apartamento-en-arriendo-en-floresta-sur-bogota/194131111","rent_cop":1000000,"administration_cop":0,"total_monthly_cop":1000000,"bedrooms":2,"area_m2":96,"laundry_evidence":"zona de ropas"},{"rank":41,"url":"https://www.fincaraiz.com.co/apartamento-en-arriendo-en-la-estrada-bogota/193751512","rent_cop":1000000,"administration_cop":0,"total_monthly_cop":1000000,"bedrooms":2,"area_m2":50,"laundry_evidence":"zona de lavanderia"},{"rank":42,"url":"https://www.fincaraiz.com.co/apartamento-en-arriendo-en-provivienda-occidental-bogota/194110012","rent_cop":1000000,"administration_cop":0,"total_monthly_cop":1000000,"bedrooms":2,"area_m2":55,"laundry_evidence":"